{
  "schemaVersion": 1,
  "edition": "Bedrock",
  "sourceRepository": "https://github.com/Mojang/bedrock-samples",
  "pinnedCommit": "736072450c26a7c67f07b1661f29d9a5ebaa14b1",
  "pinnedCommitDateUtc": "2026-08-23T16:54:08Z",
  "sourcePolicy": "OFFICIAL_PUBLIC_SAMPLE_REPOSITORY_DOWNLOAD",
  "redistributionPolicy": "DO_NOT_COMMIT_EXTRACTED_ASSETS",
  "usageGuidelines": "https://www.minecraft.net/usage-guidelines",
  "licenseSummary": "Copyright (c) Mojang AB. All rights reserved. Downloading and using these files locally for prototyping is subject to the Minecraft EULA and usage guidelines; the files must not be committed into this repository.",
  "geometryRoot": "resource_pack/models/entity",
  "textureRoot": "resource_pack/textures/entity",
  "entityGeometry": {
    "entity_bee": "bee.geo.json",
    "entity_sheep": "sheep.geo.json",
    "entity_wolf": "wolf.geo.json",
    "entity_villager": "villager_v2.geo.json",
    "entity_vindicator": "vindicator.geo.json",
    "entity_iron_golem": "iron_golem.geo.json",
    "entity_snow_golem": "snow_golem.geo.json",
    "entity_goat": "goat.geo.json",
    "entity_bat": "bat_v2.geo.json",
    "entity_cave_spider": "spider.geo.json",
    "entity_magma_cube": "slime.geo.json",
    "entity_blaze": "blaze.geo.json",
    "entity_stray": "stray.geo.json",
    "entity_salmon": "salmon.geo.json",
    "entity_dolphin": "dolphin.geo.json",
    "entity_drowned": "drowned.geo.json",
    "entity_guardian": "guardian.geo.json",
    "entity_husk": "husk.geo.json",
    "entity_pillager": "pillager.geo.json",
    "entity_camel": "camel.geo.json",
    "entity_polar_bear": "polar_bear.geo.json",
    "entity_skeleton": "skeleton.geo.json",
    "entity_turtle": "turtle.geo.json",
    "entity_zombie_pigman": "zombie_pigman.geo.json",
    "entity_strider": "strider.geo.json",
    "entity_wither_skeleton": "wither_skeleton.geo.json",
    "entity_endermite": "endermite.geo.json",
    "entity_enderman": "enderman.geo.json",
    "entity_shulker": "shulker.geo.json",
    "entity_dragon": "ender_dragon.geo.json",
    "entity_villager_desert": "villager_v2.geo.json"
  },
  "entityTextures": {
    "entity_bee": "bee/bee.png",
    "entity_sheep": "sheep/sheep.tga",
    "entity_wolf": "wolf/wolf.png",
    "entity_villager": "villager2/villager.png",
    "entity_vindicator": "vindicator.png",
    "entity_iron_golem": "iron_golem/iron_golem.png",
    "entity_snow_golem": "snow_golem.png",
    "entity_goat": "goat/goat.png",
    "entity_bat": "bat_v2.png",
    "entity_cave_spider": "spider/cave_spider.tga",
    "entity_magma_cube": "slime/magmacube.tga",
    "entity_blaze": "blaze.tga",
    "entity_stray": "skeleton/stray.png",
    "entity_salmon": "fish/salmon.png",
    "entity_dolphin": "dolphin.png",
    "entity_drowned": "zombie/drowned.tga",
    "entity_guardian": "guardian.png",
    "entity_husk": "zombie/husk.png",
    "entity_pillager": "pillager.png",
    "entity_camel": "camel/camel.png",
    "entity_polar_bear": "polarbear.png",
    "entity_skeleton": "skeleton/skeleton.png",
    "entity_turtle": "sea_turtle.png",
    "entity_zombie_pigman": "pig/pigzombie.png",
    "entity_strider": "strider/strider.png",
    "entity_wither_skeleton": "skeleton/wither_skeleton.png",
    "entity_endermite": "endermite.png",
    "entity_enderman": "enderman/enderman.tga",
    "entity_shulker": "shulker/shulker_undyed.png",
    "entity_dragon": "dragon/dragon.tga",
    "entity_villager_desert": "villager2/biomes/biome_desert.png"
  },
  "localJavaJarExtras": {
    "entity_sheep_wool": "assets/minecraft/textures/entity/sheep/sheep_wool.png",
    "entity_stray_overlay": "assets/minecraft/textures/entity/skeleton/stray_overlay.png"
  }
}